id,header_review,ulasan,label
993,Nah Lo,"Nah lo ketauan. Foto 1 n 2 akun saya, foto 3 akun suami saya. Flash sale 150 stok dibilang khbisan. Gnti motif pilih no 6 dikirim no 2. Suami ngecek tanya pelapaknya ternyata stok pilihan prtama masih banyak. Jgn diulang lg kasian pembeli",1
994,Biasaaa Ajaaaaa Ngecas Pun Lamaaaaaa,Lamaaaaa ngecasss ny biasaaaaa ajaaaa,1
995,Harganya,Lumayan bagus... syng hrga exp...,1
996,Biasa Saja,bentuknya kekinian,1
997,Sesuai Harga...,sesuai harga...,1
998,Tas Ransel,lokal sh iya beda Sama di gambar :( jahitan serba Keliatan .. mirip tas 30rb,0
999,Pelayanan Baik N Memuaskan .,Untuk order yg di respon sangat cepat .itulah bukti kalau shi pelaku usaha bener2 org yg tanggung jwb . baik order maupun service . itu kuncinya .,1
1000,Nice,nice,1